[2025-12-29 09:56:07] Starting Stage 7 reliability test suite
[2025-12-29 09:56:07] Configuration: 4 commands × 20 runs = 80 total tests
[2025-12-29 09:56:07] Dry run: true
[2025-12-29 09:56:07] 
[2025-12-29 09:56:07] Testing /research command (20 runs)
[2025-12-29 09:56:07] Running test: /research (run 1, task 300)
[2025-12-29 09:56:07] [PASS] Dry run - skipping actual execution
[2025-12-29 09:56:07] Running test: /research (run 2, task 301)
[2025-12-29 09:56:07] [PASS] Dry run - skipping actual execution
[2025-12-29 09:56:07] Running test: /research (run 3, task 302)
[2025-12-29 09:56:07] [PASS] Dry run - skipping actual execution
[2025-12-29 09:56:07] Running test: /research (run 4, task 303)
[2025-12-29 09:56:07] [PASS] Dry run - skipping actual execution
[2025-12-29 09:56:07] Running test: /research (run 5, task 304)
[2025-12-29 09:56:07] [PASS] Dry run - skipping actual execution
[2025-12-29 09:56:07] Running test: /research (run 6, task 305)
[2025-12-29 09:56:07] [PASS] Dry run - skipping actual execution
[2025-12-29 09:56:07] Running test: /research (run 7, task 306)
[2025-12-29 09:56:07] [PASS] Dry run - skipping actual execution
[2025-12-29 09:56:07] Running test: /research (run 8, task 307)
[2025-12-29 09:56:07] [PASS] Dry run - skipping actual execution
[2025-12-29 09:56:07] Running test: /research (run 9, task 308)
[2025-12-29 09:56:07] [PASS] Dry run - skipping actual execution
[2025-12-29 09:56:07] Running test: /research (run 10, task 309)
[2025-12-29 09:56:07] [PASS] Dry run - skipping actual execution
[2025-12-29 09:56:07] Running test: /research (run 11, task 310)
[2025-12-29 09:56:07] [PASS] Dry run - skipping actual execution
[2025-12-29 09:56:07] Running test: /research (run 12, task 311)
[2025-12-29 09:56:07] [PASS] Dry run - skipping actual execution
[2025-12-29 09:56:07] Running test: /research (run 13, task 312)
[2025-12-29 09:56:07] [PASS] Dry run - skipping actual execution
[2025-12-29 09:56:07] Running test: /research (run 14, task 313)
[2025-12-29 09:56:07] [PASS] Dry run - skipping actual execution
[2025-12-29 09:56:07] Running test: /research (run 15, task 314)
[2025-12-29 09:56:07] [PASS] Dry run - skipping actual execution
[2025-12-29 09:56:07] Running test: /research (run 16, task 315)
[2025-12-29 09:56:07] [PASS] Dry run - skipping actual execution
[2025-12-29 09:56:07] Running test: /research (run 17, task 316)
[2025-12-29 09:56:07] [PASS] Dry run - skipping actual execution
[2025-12-29 09:56:07] Running test: /research (run 18, task 317)
[2025-12-29 09:56:07] [PASS] Dry run - skipping actual execution
[2025-12-29 09:56:07] Running test: /research (run 19, task 318)
[2025-12-29 09:56:07] [PASS] Dry run - skipping actual execution
[2025-12-29 09:56:07] Running test: /research (run 20, task 319)
[2025-12-29 09:56:07] [PASS] Dry run - skipping actual execution
[2025-12-29 09:56:07] 
[2025-12-29 09:56:07] [INFO] /research results: 0/20 (0%)
[2025-12-29 09:56:07] 
[2025-12-29 09:56:07] Testing /plan command (20 runs)
[2025-12-29 09:56:07] Running test: /plan (run 1, task 320)
[2025-12-29 09:56:07] [PASS] Dry run - skipping actual execution
[2025-12-29 09:56:07] Running test: /plan (run 2, task 321)
[2025-12-29 09:56:07] [PASS] Dry run - skipping actual execution
[2025-12-29 09:56:07] Running test: /plan (run 3, task 322)
[2025-12-29 09:56:07] [PASS] Dry run - skipping actual execution
[2025-12-29 09:56:07] Running test: /plan (run 4, task 323)
[2025-12-29 09:56:07] [PASS] Dry run - skipping actual execution
[2025-12-29 09:56:07] Running test: /plan (run 5, task 324)
[2025-12-29 09:56:07] [PASS] Dry run - skipping actual execution
[2025-12-29 09:56:07] Running test: /plan (run 6, task 325)
[2025-12-29 09:56:07] [PASS] Dry run - skipping actual execution
[2025-12-29 09:56:07] Running test: /plan (run 7, task 326)
[2025-12-29 09:56:07] [PASS] Dry run - skipping actual execution
[2025-12-29 09:56:08] Running test: /plan (run 8, task 327)
[2025-12-29 09:56:08] [PASS] Dry run - skipping actual execution
[2025-12-29 09:56:08] Running test: /plan (run 9, task 328)
[2025-12-29 09:56:08] [PASS] Dry run - skipping actual execution
[2025-12-29 09:56:08] Running test: /plan (run 10, task 329)
[2025-12-29 09:56:08] [PASS] Dry run - skipping actual execution
[2025-12-29 09:56:08] Running test: /plan (run 11, task 330)
[2025-12-29 09:56:08] [PASS] Dry run - skipping actual execution
[2025-12-29 09:56:08] Running test: /plan (run 12, task 331)
[2025-12-29 09:56:08] [PASS] Dry run - skipping actual execution
[2025-12-29 09:56:08] Running test: /plan (run 13, task 332)
[2025-12-29 09:56:08] [PASS] Dry run - skipping actual execution
[2025-12-29 09:56:08] Running test: /plan (run 14, task 333)
[2025-12-29 09:56:08] [PASS] Dry run - skipping actual execution
[2025-12-29 09:56:08] Running test: /plan (run 15, task 334)
[2025-12-29 09:56:08] [PASS] Dry run - skipping actual execution
[2025-12-29 09:56:08] Running test: /plan (run 16, task 335)
[2025-12-29 09:56:08] [PASS] Dry run - skipping actual execution
[2025-12-29 09:56:08] Running test: /plan (run 17, task 336)
[2025-12-29 09:56:08] [PASS] Dry run - skipping actual execution
[2025-12-29 09:56:08] Running test: /plan (run 18, task 337)
[2025-12-29 09:56:08] [PASS] Dry run - skipping actual execution
[2025-12-29 09:56:08] Running test: /plan (run 19, task 338)
[2025-12-29 09:56:08] [PASS] Dry run - skipping actual execution
[2025-12-29 09:56:08] Running test: /plan (run 20, task 339)
[2025-12-29 09:56:08] [PASS] Dry run - skipping actual execution
[2025-12-29 09:56:08] 
[2025-12-29 09:56:08] [INFO] /plan results: 0/20 (0%)
[2025-12-29 09:56:08] 
[2025-12-29 09:56:08] Testing /implement command (20 runs)
[2025-12-29 09:56:08] Running test: /implement (run 1, task 340)
[2025-12-29 09:56:08] [PASS] Dry run - skipping actual execution
[2025-12-29 09:56:08] Running test: /implement (run 2, task 341)
[2025-12-29 09:56:08] [PASS] Dry run - skipping actual execution
[2025-12-29 09:56:08] Running test: /implement (run 3, task 342)
[2025-12-29 09:56:08] [PASS] Dry run - skipping actual execution
[2025-12-29 09:56:08] Running test: /implement (run 4, task 343)
[2025-12-29 09:56:08] [PASS] Dry run - skipping actual execution
[2025-12-29 09:56:08] Running test: /implement (run 5, task 344)
[2025-12-29 09:56:08] [PASS] Dry run - skipping actual execution
[2025-12-29 09:56:08] Running test: /implement (run 6, task 345)
[2025-12-29 09:56:08] [PASS] Dry run - skipping actual execution
[2025-12-29 09:56:08] Running test: /implement (run 7, task 346)
[2025-12-29 09:56:08] [PASS] Dry run - skipping actual execution
[2025-12-29 09:56:08] Running test: /implement (run 8, task 347)
[2025-12-29 09:56:08] [PASS] Dry run - skipping actual execution
[2025-12-29 09:56:08] Running test: /implement (run 9, task 348)
[2025-12-29 09:56:08] [PASS] Dry run - skipping actual execution
[2025-12-29 09:56:08] Running test: /implement (run 10, task 349)
[2025-12-29 09:56:08] [PASS] Dry run - skipping actual execution
[2025-12-29 09:56:08] Running test: /implement (run 11, task 350)
[2025-12-29 09:56:08] [PASS] Dry run - skipping actual execution
[2025-12-29 09:56:08] Running test: /implement (run 12, task 351)
[2025-12-29 09:56:08] [PASS] Dry run - skipping actual execution
[2025-12-29 09:56:08] Running test: /implement (run 13, task 352)
[2025-12-29 09:56:08] [PASS] Dry run - skipping actual execution
[2025-12-29 09:56:08] Running test: /implement (run 14, task 353)
[2025-12-29 09:56:08] [PASS] Dry run - skipping actual execution
[2025-12-29 09:56:08] Running test: /implement (run 15, task 354)
[2025-12-29 09:56:08] [PASS] Dry run - skipping actual execution
[2025-12-29 09:56:08] Running test: /implement (run 16, task 355)
[2025-12-29 09:56:08] [PASS] Dry run - skipping actual execution
[2025-12-29 09:56:08] Running test: /implement (run 17, task 356)
[2025-12-29 09:56:08] [PASS] Dry run - skipping actual execution
[2025-12-29 09:56:08] Running test: /implement (run 18, task 357)
[2025-12-29 09:56:08] [PASS] Dry run - skipping actual execution
[2025-12-29 09:56:08] Running test: /implement (run 19, task 358)
[2025-12-29 09:56:08] [PASS] Dry run - skipping actual execution
[2025-12-29 09:56:08] Running test: /implement (run 20, task 359)
[2025-12-29 09:56:08] [PASS] Dry run - skipping actual execution
[2025-12-29 09:56:08] 
[2025-12-29 09:56:08] [INFO] /implement results: 0/20 (0%)
[2025-12-29 09:56:08] 
[2025-12-29 09:56:08] Testing /revise command (20 runs)
[2025-12-29 09:56:08] Running test: /revise (run 1, task 360)
[2025-12-29 09:56:08] [PASS] Dry run - skipping actual execution
[2025-12-29 09:56:08] Running test: /revise (run 2, task 361)
[2025-12-29 09:56:08] [PASS] Dry run - skipping actual execution
[2025-12-29 09:56:08] Running test: /revise (run 3, task 362)
[2025-12-29 09:56:08] [PASS] Dry run - skipping actual execution
[2025-12-29 09:56:08] Running test: /revise (run 4, task 363)
[2025-12-29 09:56:08] [PASS] Dry run - skipping actual execution
[2025-12-29 09:56:08] Running test: /revise (run 5, task 364)
[2025-12-29 09:56:08] [PASS] Dry run - skipping actual execution
[2025-12-29 09:56:08] Running test: /revise (run 6, task 365)
[2025-12-29 09:56:08] [PASS] Dry run - skipping actual execution
[2025-12-29 09:56:08] Running test: /revise (run 7, task 366)
[2025-12-29 09:56:08] [PASS] Dry run - skipping actual execution
[2025-12-29 09:56:08] Running test: /revise (run 8, task 367)
[2025-12-29 09:56:08] [PASS] Dry run - skipping actual execution
[2025-12-29 09:56:08] Running test: /revise (run 9, task 368)
[2025-12-29 09:56:08] [PASS] Dry run - skipping actual execution
[2025-12-29 09:56:08] Running test: /revise (run 10, task 369)
[2025-12-29 09:56:08] [PASS] Dry run - skipping actual execution
[2025-12-29 09:56:08] Running test: /revise (run 11, task 370)
[2025-12-29 09:56:08] [PASS] Dry run - skipping actual execution
[2025-12-29 09:56:08] Running test: /revise (run 12, task 371)
[2025-12-29 09:56:08] [PASS] Dry run - skipping actual execution
[2025-12-29 09:56:08] Running test: /revise (run 13, task 372)
[2025-12-29 09:56:08] [PASS] Dry run - skipping actual execution
[2025-12-29 09:56:08] Running test: /revise (run 14, task 373)
[2025-12-29 09:56:08] [PASS] Dry run - skipping actual execution
[2025-12-29 09:56:08] Running test: /revise (run 15, task 374)
[2025-12-29 09:56:08] [PASS] Dry run - skipping actual execution
[2025-12-29 09:56:08] Running test: /revise (run 16, task 375)
[2025-12-29 09:56:08] [PASS] Dry run - skipping actual execution
[2025-12-29 09:56:08] Running test: /revise (run 17, task 376)
[2025-12-29 09:56:08] [PASS] Dry run - skipping actual execution
[2025-12-29 09:56:08] Running test: /revise (run 18, task 377)
[2025-12-29 09:56:08] [PASS] Dry run - skipping actual execution
[2025-12-29 09:56:08] Running test: /revise (run 19, task 378)
[2025-12-29 09:56:08] [PASS] Dry run - skipping actual execution
[2025-12-29 09:56:08] Running test: /revise (run 20, task 379)
[2025-12-29 09:56:08] [PASS] Dry run - skipping actual execution
[2025-12-29 09:56:08] 
[2025-12-29 09:56:08] [INFO] /revise results: 0/20 (0%)
[2025-12-29 09:56:08] 
[2025-12-29 09:56:08] =========================================
[2025-12-29 09:56:08] Stage 7 Reliability Test Results
[2025-12-29 09:56:08] =========================================
[2025-12-29 09:56:08] 
[2025-12-29 09:56:08] Per-Command Results:
[2025-12-29 09:56:08]   /research: 0/20 (0%)
[2025-12-29 09:56:08]   /plan: 0/20 (0%)
[2025-12-29 09:56:08]   /implement: 0/20 (0%)
[2025-12-29 09:56:08]   /revise: 0/20 (0%)
[2025-12-29 09:56:08] 
[2025-12-29 09:56:08] Overall Results:
[2025-12-29 09:56:08]   Total tests: 80
[2025-12-29 09:56:08]   Passed: 0
[2025-12-29 09:56:08]   Failed: 80
[2025-12-29 09:56:08]   Success rate: 0%
[2025-12-29 09:56:08] 
[2025-12-29 09:56:08] [FAIL] Stage 7 reliability: 0% (significantly below 100% target)
[2025-12-29 09:56:08] 
[2025-12-29 09:56:08] Results saved to: /home/benjamin/Projects/ProofChecker/.opencode/specs/247_phase_4_testing_and_documentation/metrics/stage7-results-20251229_095607.json
[2025-12-29 09:56:08] Log saved to: /home/benjamin/Projects/ProofChecker/.opencode/specs/247_phase_4_testing_and_documentation/logs/test-stage7-reliability-20251229_095607.log
